{
  "updated_at": "2026-01-17T18:30:00Z",
  "summary": {
    "project": "coffee-shop-manager",
    "current_feature": "Revenue Reports",
    "current_task": "Implement daily revenue chart",
    "status": "coding",
    "progress_percent": 65,
    "last_action": "Added revenue API endpoint",
    "next_step": "Wire chart component with date range filter",
    "blockers_count": 0
  },
  "working_on": {
    "feature": "Revenue Reports",
    "task": "Implement daily revenue chart",
    "status": "coding",
    "files": [
      "src/features/reports/components/revenue-chart.tsx",
      "src/features/reports/api/get-revenue.ts"
    ],
    "blockers": [],
    "notes": "Using recharts for visualization"
  },
  "pending_tasks": [
    {
      "task": "Add date range filter to revenue chart",
      "priority": "medium",
      "notes": "User request from demo"
    },
    {
      "task": "Fix timezone issue in report",
      "priority": "high",
      "notes": "Report shows UTC, need GMT+7"
    }
  ],
  "recent_changes": [
    {
      "timestamp": "2026-01-17T15:00:00Z",
      "type": "feature",
      "description": "Added revenue API endpoint",
      "files": ["src/features/reports/api/get-revenue.ts"]
    },
    {
      "timestamp": "2026-01-16T10:00:00Z",
      "type": "bugfix",
      "description": "Fixed order total calculation",
      "files": ["src/features/orders/utils/calculate-total.ts"]
    }
  ],
  "errors_encountered": [
    {
      "error": "Prisma client not found in production",
      "solution": "Add 'prisma generate' to postinstall script",
      "resolved": true
    }
  ],
  "decisions_made": [
    {
      "decision": "Use recharts instead of Chart.js",
      "reason": "Better React integration, smaller bundle size"
    }
  ]
}
